,0,1,2
0,Shitty Rules [Read before posting],t3_es5n7i,1579690068.0
1,"Any water gun you shoot fires actual bullets, while any real gun shoots water.",t3_izzgfn,1601124038.0
2,You now have the ability to make babies cry or shit on command.,t3_j00mg1,1601129026.0
3,You can make someone pee for you when you feel like peeing.,t3_j00192,1601126452.0
4,You can predict the end of a movie though it takes as long as the movie itself to to that,t3_iztyol,1601103050.0
5,You can tell if a person is romantically interested in you but only after you shit your pants in front of them,t3_izw0q5,1601110629.0
6,You can lift your balls with YOUR MIND!,t3_iz7qv3,1601016723.0
7,"For every full bottle of dried oregano you eat, you can shoot fully cooked spaghetti out of your fingertips for up to an hour",t3_izqrsy,1601092755.0
8,"When you wake up from a dream, you wake up in the exact same location as the one in the setting of your dream.",t3_izxcsa,1601115781.0
9,you are now Florida man,t3_izzzqi,1601126260.0
10,you have wings that are controlled by your boner,t3_j0179j,1601131774.0
11,You can make people forget that you have this superpower.,t3_izr290,1601093647.0
12,You can turn yourself inside out,t3_j003ip,1601126720.0
13,The ability to stare directly at the sun without blinking.,t3_j001j6,1601126483.0
14,You can add a second to your lifespan by wearing a robe for a year.,t3_izx9ah,1601115384.0
15,You can switch places of your legs.,t3_izx33v,1601114726.0
16,"When you’re happy and you know it, you make other people clap their hands",t3_j02f42,1601137850.0
17,Your vision is constantly zoomed in,t3_izw0gp,1601110602.0
18,Everytime you break a bone you get a five dollar discount on every store you go,t3_izwbpw,1601111792.0
19,"Your farts smell like perfume, except that you need to be naked while farting.",t3_izxkk5,1601116612.0
20,You can time travel. To do so you must shit your pants and you can only travel to a point in the past that you also shit your pants.,t3_izwv5g,1601113896.0
21,Any sentence you post in r/Shower thoughts will instantly become so complicated that people can only assume it's something vaguely like an actual shower thought,t3_izyqo9,1601121177.0
22,To make your belly button actually talk,t3_izv3af,1601107156.0
23,You can roll up the skin on your arms like sleeves,t3_iz2952,1600999222.0
24,You can permanently disguise as someone by sneezing on them,t3_izxreq,1601117360.0
25,"You can now talk to plants, keep in mind the plants won’t talk back",t3_izvhbd,1601108574.0
26,you can tie shoes really fast,t3_izxbfk,1601115628.0
27,your spit can be used as a weak detergent,t3_izxayj,1601115573.0
28,You now can swap heads with a fly,t3_izsgpo,1601098137.0
29,You are what you eat.,t3_izrmfn,1601095421.0
30,You can vomit on command,t3_izp43j,1601087704.0
31,You have the power to feel the pain that the ground feel When u step in it,t3_izwvit,1601113936.0
32,Your urine turns things gold,t3_izsk4q,1601098451.0
33,You can teleport anyone anywhere with a rotten dish of their favorite food,t3_izvomk,1601109343.0
34,You can change your ethnicity by the types of foods you eat,t3_j00y5c,1601130533.0
35,Any cavemen near you will automatically die.,t3_izo3ko,1601084559.0
36,You can summon a thick sphere of seran wrap around a racist's head at will.,t3_izuph1,1601105727.0
37,You age five years each time you talk in Old English,t3_izximc,1601116398.0
38,You know every answer to every test when you moan really loud,t3_izgww4,1601057523.0
39,You can prevent rain from happening when going out carrying an umbrella,t3_izv8um,1601107713.0
40,You can make people use the metric system,t3_izldjf,1601076013.0
41,You can out-obvious Captain Obvious. Obviously.,t3_j00dx3,1601127978.0
42,You can turn off friction for yourself at will,t3_izu29n,1601103394.0
43,You can make others hear food screem when you consume it,t3_izseov,1601097947.0
44,You can turn into a bush,t3_izh2b5,1601058411.0
45,You can be invisible only when you masturbate,t3_iztm2t,1601101868.0
46,"Every time someone tries to read your mind, your thoughts instantly switch to oppa gangnam style",t3_iz7two,1601017027.0
47,You can telepathically Rick Roll,t3_izrzms,1601096588.0
48,Everything you eat taste like choco-mint.,t3_j02klg,1601138624.0
49,You always know why a helicopter is flying overhead,t3_izly80,1601077862.0
50,You can know who the imposter/s is/are in Among Us.,t3_iztiys,1601101582.0
51,Your foreskin comes all the way back &amp; you can take your entire skin off.,t3_izhvh3,1601062707.0
52,You can turn dead frogs to stone,t3_izj0t4,1601067759.0
53,"If more than 50 percent of your fart enters a persons lungs, they fall in love with you on the spot.",t3_izt5oe,1601100390.0
54,You have the power to read your own mind!,t3_iznbeq,1601082143.0
55,You can piss ants which will proceed to march to the nearest chicken and swarm it,t3_izss27,1601099175.0
56,You now can talk to plants,t3_izsi1x,1601098258.0
57,Everytime you close your eyes you cant see.,t3_izuqd2,1601105818.0
58,"Every time u click ur mouse button, you earn 0.001$.",t3_izp4yn,1601087773.0
59,Spiderwebs will glow so you can see them 7 inches away from you,t3_izuj3m,1601105081.0
60,You can speak any language.. butt every sentence you speak has to end with that language’s translation of “no homo.”,t3_izqc16,1601091403.0
61,You can find anything that you can see.,t3_izxxfy,1601118046.0
62,"You can point at someone and make their skin any color you want, or make it see-through so their insides are showing.",t3_izu412,1601103574.0
63,Having the ability to smell an erection within 27 yards,t3_izsjjv,1601098394.0
64,You know the name of anyone you touch,t3_j00r5j,1601129618.0
65,You can lure the closest ambulance when you shit your pants.,t3_izh7fn,1601059206.0
66,"By kissing someone on the lips, you can pop a dollar out of your ass",t3_izl13t,1601074911.0
67,You can make any towel of your choice wet with the snap of your fingers.,t3_izs2r2,1601096864.0
68,You can read peoples minds when they think negatively of you,t3_j00fyt,1601128225.0
69,"You can instantly grow any plant, and as soon as it comes into contact with semen, it explodes and leaves behind a turtle, which will die after 4 seconds",t3_j00bzc,1601127743.0
70,You can think of all the puns you could make in a conversation,t3_j003ef,1601126708.0
71,Your butthole works like a Chinese finger trap.,t3_izrj9f,1601095129.0
72,"Every time you blink, a random person in your country poops",t3_izsq6j,1601099004.0
73,You can speak every language and don’t understand what you or others are thinking/saying,t3_izsmux,1601098693.0
74,You body will turn to dried leaves when you die.,t3_izr93r,1601094254.0
75,You can become invisible when you have more than 100 living spiders on your skin,t3_izorq3,1601086642.0
76,You can hit your head on a wall 4 times before it starts hurting.,t3_izm3s6,1601078353.0
77,"When eating food that you dip into a condiment, you always finish both with no leftover.",t3_izofzy,1601085635.0
78,You can instantly infer context from any quote or reference made within your hearing.,t3_izpf9w,1601088636.0
79,You can summon the band Smash Mouth to any viable location for a pop-up concert!,t3_izgbd2,1601054039.0
80,"You’ll be super smart at math though you’ll be incompatible to read, talk and write when u use the ability",t3_iznnkb,1601083182.0
81,All your pets have 9 lives,t3_izrmv9,1601095457.0
82,You always get a 1% discount on all the rugs you buy,t3_izrjtj,1601095181.0
83,You can stop sand from getting between your toes if you complain about it,t3_izoa7h,1601085127.0
84,Playing the flute like a snake charmer will make any ants in the surrounding area slightly dizzy.,t3_izoa6t,1601085126.0
85,You can walk through closed doors only if they’re also unlocked,t3_izn3n0,1601081475.0
86,Stepping into sunlight sets a random thing on fire,t3_izphzh,1601088865.0
87,You can make yourself 10% more likely to be struck by lightning.,t3_iz8nlj,1601020043.0
88,You can eat 100 year old eggs without getting sick and you actually like them,t3_izpeup,1601088601.0
89,You can delete other peoples comments.,t3_izlxk2,1601077800.0
90,You can puke blood at your will.,t3_izexyn,1601046289.0
91,"Whenever you're horny, you can summon any character, fictional or not, and it will always have an appearance that'll turn you off.",t3_izl3qo,1601075131.0
92,You run 10% faster while you're masturbating.,t3_izezhq,1601046528.0
93,"You can go 60 seconds into the past, by swinging all the way round on a swing set.",t3_izf8z3,1601047981.0
94,You can lift one pound more than the weakest person in the room.,t3_iznifz,1601082731.0
95,"You can see in the dark, only if you close your eyes",t3_izdquc,1601040276.0
96,You can throw your eyelashes like boomerangs,t3_izfc41,1601048440.0
97,You become bulletproof after you get shot,t3_izmep7,1601079310.0
98,You can make your feet shrink.,t3_izm7zp,1601078713.0
99,You can walk through walls and your cloths cannot.,t3_izf0gf,1601046675.0
100,"You see, hear, etc. 2 seconds in the future. You can't see the ""now"" while this ability is active.",t3_izltnu,1601077440.0
101,You can see throught mask,t3_izjupn,1601070935.0
102,You can instantly change all of the m&amp;ms in any bag of trail mix to skittles.,t3_iz8kud,1601019758.0
103,You can make people believe you're a meth-addicted street beggar anytime you want.,t3_izl18v,1601074923.0
104,You can teleport your toenail clippings,t3_izk6nr,1601072105.0
105,There is a 50% chance you get an erection if the teacher asks you to stand up,t3_izk6gk,1601072085.0
106,"For every giant glass of milk you drink, your bones are indestructible for 1 hour. For every galloon of milk you can grow 1 bone wherever you want.",t3_iz8qjt,1601020342.0
107,You are an earthbender though everyone else is a avatar,t3_izjmpe,1601070131.0
108,Can't do title BC not creative,t3_izgo96,1601056138.0
109,The sound of your sneeze is replaced by a loud and long moan.,t3_izeypa,1601046401.0
110,You can command dragons. Too bad there are no dragons in your lifetime.,t3_izey2i,1601046307.0
111,Each time you punch someone,t3_izb2ho,1601029078.0
112,You can tell if someone is lying if they tell you so,t3_izp7qc,1601088006.0
113,In a similar fashion to Avatar The Last Airbender you too are now a bender... of pubes,t3_iz9lu1,1601023514.0
114,"People will never reply to your texts with a ""hmmm"".",t3_izezxi,1601046595.0
115,"As long as you're completely naked and not touching any part of yourself, you're invulnerable.",t3_izg8o4,1601053604.0
116,You can take your nose off to pick it.,t3_izfmkv,1601050035.0
117,You are just as invisible as you feel you are.,t3_izekzj,1601044391.0
118,"You have a paralyzing fear of water, and every time you think about swimming and feel that fear everyone within 5 miles screams and slaps themselves.",t3_izgmki,1601055875.0
119,You can explain to people why Epstein didn't kill himself.,t3_iz18ku,1600996080.0
120,"Every time you think in of a number, someone randomly around the world will have his finger grown that size",t3_izhfz5,1601060532.0
121,You can gain or lose weight by willing non-lethal constipation or diarrhea upon yourself for as long as necessary to get the job done.,t3_izcjd5,1601034993.0
122,Time only moves when looking at a clock.,t3_izbfzr,1601030521.0
123,"You can teleport, but only to the location of the nearest Juggalo",t3_izirxk,1601066746.0
124,You have x-ray vision,t3_izewjl,1601046081.0
125,"When you masturbate in a room with closed doors, anyone who wants to open any door must solve a reCAPTCHA. Effect voided when you orgasm.",t3_iyze68,1600990288.0
126,"Whenever you dab, a random person farts.",t3_izen3c,1601044687.0
127,You can teleport short distance only when people eyes are closed,t3_izg4pq,1601052946.0
128,"You can never lose your nerf darts, ever",t3_izcbu4,1601034103.0
129,You know what Time is it in random Country Just by taking a shit,t3_izen56,1601044693.0
130,Anything you touch becomes the last thing you touched.,t3_izbiov,1601030827.0
131,Your hair is spaghetti,t3_izargl,1601027924.0
132,You can summon crayons by pulling them out of other people's pockets,t3_iz2kh3,1601000163.0
133,"Every time your heart beats someone random in the world becomes 1% shorter, this can incude you.",t3_izbc0d,1601030097.0
134,All your limbs have foreskin,t3_izeuiu,1601045778.0
135,every time you fart on Tuesday at 4:30 pm someone you hate gets a bowl of cold pasta,t3_iz12tw,1600995556.0
136,You are granted the power of invisibility and you need to do a triple backflip to activate it,t3_iz189o,1600996051.0
137,You can give yourself temporarily deafening tinnitus to tune out other loud or annoying noises,t3_ize79z,1601042489.0
138,If a type of porn dose not exist you can make it exist by doing that type of new porn with a person.,t3_izbkrg,1601031056.0
139,"You can slow down time 90% for you at will, so you move and think ten times as fast",t3_iz9449,1601021672.0
140,You can desychronize all clocks in a 1 kilometer radius at will.,t3_izci53,1601034841.0
141,You can sprint full speed while carrying a hot drink and not spill a drop.,t3_iyw33f,1600978408.0
142,You can lick your elbow,t3_iz6f1u,1601012230.0
143,You can only eat what your reddit username is.,t3_izbt21,1601031974.0
144,Your mutant evolution has given you the proper anatomy to posses a functional cloaca.,t3_izen2c,1601044684.0
145,"You can freely move any object 2 solar masses or larger at speeds up to .99c, so long as you are within 10au of said object.",t3_izbfyz,1601030518.0
146,"Everytime you pee in bed, someone else's bed gets wet.",t3_iz15dp,1600995787.0
147,Magical van of stuff and things,t3_izbuya,1601032185.0
148,You can slow down any elevator that you are inside,t3_iy9m5e,1600894814.0
149,Everytime you come across a good and funny meme you are granted a dolar and you have to pay 50 cents for every meme you see,t3_iz19w2,1600996189.0
150,Your power is you're invisable only at the skin layer,t3_iz8cll,1601018900.0
151,You can eat plain nacho cheese Doritos vertically in one bite.,t3_iz1emi,1600996605.0
152,You can walk on water only when you are walking backwards,t3_iyypy7,1600988046.0
153,You can look at yourself in the mirror while wiping your butt without feeling ashamed about yourself.,t3_iyyg4z,1600987119.0
154,You can make disappear the last word of any,t3_iz3aow,1601002361.0
155,Every single ass hair you have can move and has its own will.,t3_iz7azi,1601015158.0
156,You have super-hightened sense of smell with a bad memory of what the smell is of,t3_iz0v17,1600994888.0
157,"You can only laugh at the worse possible times, and your laugh is a really bad cliche evil laugh.",t3_iyz88e,1600989745.0
158,Everytime you smell something familiar thr urge to take a shit increases by 20%,t3_iz12tr,1600995556.0
159,You have an amazing voice. Any person who hears your voice for the first time stops whatever he/she was doing and appreciates it for 10 whole minutes.,t3_iz2kbo,1601000149.0
160,"When you hug someone, they get a cool superpower.",t3_iyub9z,1600970114.0
161,"You are able to make 1 wish every time you kill someone. You cannot wish them back to life, and you cannot wish for more wishes.",t3_iyzh22,1600990535.0
162,"You Can Run At The Speed Of Light for 0.1 Seconds, And You Can Only Do It Once",t3_iz11me,1600995451.0
163,"Everytime you kiss a certain person, you swear you can fly",t3_izd6aj,1601037693.0
164,Your tears taste sweet instead of salty,t3_iyx7jg,1600982729.0
165,You can cure yourself from all diseases by eating a full bar of soap,t3_iyx6m1,1600982629.0
166,You can pay for microtransactions with Cash by inserting it some how into your gaming console or pc,t3_iyvqjt,1600977016.0
167,You can choose what colour your eyes are,t3_iyurp1,1600972431.0
168,"When you hold your breath, you become weightless.",t3_iyt4is,1600963637.0
169,When you have your pants on your dick is massive except when you take them off it instantly becomes tiny,t3_iyzv5a,1600991794.0
170,Everytime you sneeze your eyelashes change with the ones of a random person,t3_iyunlc,1600971858.0
171,"Whenever you touch someone, you will be able to decide whether or not the soap will be foamy when the next time they take a shower.",t3_iyvm5e,1600976467.0
172,"You can read the first chapter of a book by looking at its cover, online or otherwise.",t3_iyuupf,1600972848.0
173,You have the power to forget your cake day,t3_iyy1my,1600985723.0
174,You can squeeze out hairs like popping pimples,t3_iyx3kt,1600982302.0
175,You can shift the location of your wounds.,t3_iyt4k8,1600963642.0
176,Your eyes are made of bacon,t3_iys0kj,1600957831.0
177,You can teleport at will,t3_iysje1,1600960588.0
178,Red Bull with extra steps,t3_iyuq6h,1600972219.0
179,you can give people explosive diarrhea by winking at them witch both eyes at the same time,t3_iyt202,1600963279.0
180,"You have the ability to switch context immediately with the person you are conversing with, avoiding to reiterate the backstory.",t3_iyviwn,1600976078.0
181,You cannot be accidentally hurt.,t3_iyt4jg,1600963639.0
182,When you smile everyone smiles back at you.,t3_iyr39x,1600953486.0
183,You can get that one hair off your tongue on the first try,t3_iyq4zu,1600949463.0
184,Between 3-4 pm you can immediately summon any famous person literally by your side. They really like you for 10 minutes then after that they try and kill you. At 4 pm they get sent back.,t3_iyqa4b,1600950043.0
185,While both of your hands are touching your face you can see perfectly in the dark,t3_iyns8m,1600940767.0
186,"You have the ability to be invincible if your standing still, just have a really bad itch in a spot you can’t reach.",t3_iyoo5z,1600943930.0
187,Every time you strike a pose anyone who looks at you will hear Jojo music in their head,t3_iy9ug8,1600895622.0
188,It is impossible for everyone in your vicinity to filter out the rude words from their speech.,t3_iysl5d,1600960840.0
189,You can turn your fingers into fish fingers,t3_iyn9x6,1600939045.0
190,"When your bladder is full, it becomes a deity that must be worshiped in the eyes of others and a demon that must be killed when it’s empty.",t3_iyoope,1600943991.0
191,You can fasttalk people about why they should become a jehovah's witness until you are completely exausted,t3_iyrnhg,1600956021.0
192,You can read minds and you hear it in a long lost dialect,t3_iymi35,1600936570.0
193,"Every time you fart, a random person around the world gains the ability to burp 0.1 decibels louder.",t3_iyc58m,1600903261.0
194,Nickelback songs for receiving nickels,t3_iyrc21,1600954587.0
195,You are biologically immortal. You can’t die of of old age yet you will still be susceptible to diseases and physical trauma,t3_iyhw5h,1600920288.0
196,"You are Invisible, but only when nothing is looking at you.",t3_iybz0o,1600902712.0
197,You can make subways go out of service at will,t3_iym5v4,1600933626.0
198,promises made to someone on their deathbed will have the exact opposite effect,t3_iyp9br,1600946107.0
199,You can weaponize turtles by shoving them in people’s asses,t3_iyf6e7,1600912371.0
200,Turning a computer off and on again fixes every computer problem,t3_iyimv7,1600922471.0
201,You can turn plastic into paper,t3_iyksy4,1600929107.0
202,Your pinky toe has the ability to find the corner of anything while walking or running.,t3_iybc14,1600900656.0
203,Your dick appears 2 inches larger when women aren't looking at it,t3_iycaq8,1600903725.0
204,you can waterbend the toilet water that you shit in,t3_iyi76l,1600921172.0
205,"You can fly, just an inch off the ground",t3_iye4uh,1600909320.0
206,You can slow time by making people uncomfortable. The more awkward the slower time passes.,t3_iyh2um,1600917988.0
207,You can open a portal to any place in the universe except you cant control the size and it never closes.,t3_iyfm4j,1600913666.0
208,You can tickle anyone at a range of 10 meters,t3_iy7hnx,1600885199.0
209,You can make anybody's farts sould like a song of your choosing.,t3_iybsdo,1600902140.0
210,You will not experience the fear of falling off the chair everytime you lean back a little bit too much,t3_iyc4ll,1600903207.0
211,"Every time you break something, it immediately becomes clean",t3_iyibra,1600921547.0
212,Everything you say is a JoJo reference.,t3_iydzwm,1600908908.0
213,You can control the rate at which time flows for everyone and everything everywhere while maintaining precisely the relativity matrix within which the universe operates.,t3_iym16c,1600933206.0
214,You can control all of the world’s warm mashed potatoes at once,t3_iydapw,1600906837.0
215,whenever chewing gum your shoe gets gum on it the worst things that can get on it get on it.,t3_iykfsb,1600927980.0
216,Your penis can switch places with any hole in your body.,t3_iyhz3i,1600920510.0
217,Every chair you sit on has a 70/30 chance of falling apart,t3_iybfkh,1600900975.0
218,People can't talk shit behind your back,t3_iycc8m,1600903861.0
219,You can make your piss any color if you ate food with that color within 24 hours.,t3_iyhspx,1600920018.0
220,"Everytime you get punched/hurt, a ""harder, daddy"" sound effect plays",t3_iybbaw,1600900592.0
221,You can perfectly mimic the voice of Bill Cosby while on television.,t3_iyfn1a,1600913745.0
222,Designated driver hangovers,t3_iyr88t,1600954114.0
223,"You can see the future, only the cringy moments that will happen to you and nothing else.",t3_iyc8xh,1600903572.0
224,You can stop someone else from sneezing and it makes you sneeze instead.,t3_iyjjal,1600925139.0
225,People Cannot open the post and see the rest of the text in the discription,t3_iycd21,1600903936.0
226,You can grind salt and pepper by holding them in your palm and moving your hands as if you are using a salt grinder,t3_iyf5h2,1600912292.0
227,You can get that one hair off your younger on the first try,t3_iyq444,1600949364.0
228,You can always get the pre-order bonus for videogames,t3_iyapiv,1600898576.0
229,You can teleport 1-3.Ft in a random direction,t3_iybj7o,1600901319.0
230,"Whenever you want to rexperience nostalgia, you can time travel to that point of time.",t3_iybygp,1600902662.0
231,"Everything you see is a flaming homosexual, and people who are flaming homosexual, are straight lawyers",t3_iyel77,1600910636.0
232,Mosquitoes are happy to see you.,t3_iyalnn,1600898233.0
233,You can loose hair whenever you want and it falls all at once,t3_iyjz1d,1600926524.0
234,"You can see and talk to dead people. They don't say or do anything, themselves though, because they're dead.",t3_ixjfh2,1600791780.0
235,Everytime you touch a dog he will massively cum,t3_iy7gar,1600884987.0
236,You are deaf while sleeping.,t3_iy7qn4,1600886492.0
237,You can read people's minds. Everything is translated into a language you can't understand.,t3_iy5tgl,1600875955.0
238,"You can say the n word and black people will see you black everytime you say it, so you good",t3_iy7h9x,1600885141.0
239,The ability to predict the weather everytime you get a migraine.,t3_iy9w13,1600895784.0
240,What ever you do will always be reflected back on you except with a 100x multiplier such as hit a person softly your head will explode or you will get severe brain trauma.,t3_iyf1zd,1600912002.0
241,You can telepathically project the comebacks you make in the shower.,t3_iy3lpd,1600864562.0
242,"Every time you upvote anything on Reddit, the post gets a free silver award.",t3_ixyztp,1600846703.0
243,Every door you want to open unlocks immediately,t3_iy76v5,1600883601.0
244,You can now instantly tell if someone has lost a game of russian roulette.,t3_iy593v,1600872870.0
245,You can make random objects grow hair of any length.,t3_iy3pr3,1600865076.0
246,"Everytime you go take a dump, you become the best singer in the entire world",t3_iy7i0l,1600885251.0
247,Your crush and any girl on the world will consider you attractive,t3_iy7gze,1600885093.0
248,You can predict tomorrow’s fake news,t3_iy6kti,1600880175.0
249,You can change the curvature of beans,t3_iy0gfs,1600852058.0
250,You put a industrial smelter in Roblox Skyblock in another person's chest that is not yours,t3_iyag9f,1600897725.0
251,You have all the knowledge of how to play a violin when holding a guitar.,t3_ixweml,1600837866.0
252,"Anytime you’re around any kind of corn, it turns into popcorn",t3_iy2rjh,1600860983.0
253,Everytime you get hit by a car it changes color,t3_iy1qku,1600856920.0
254,"Whenever you're in a public bathroom, you have the ability to turn into an insect of your choise. You can only turn back into a human in a kitchen",t3_iy6j8w,1600879930.0
255,You aren’t able to... yeah that’s it you just aren’t able to,t3_iy232e,1600858257.0
256,You can guess the expiration date of food and drink just by looking at the tag.,t3_ixx81x,1600840476.0
257,You can grow your toes any length you want.,t3_ixz4hk,1600847161.0
258,"You can open up a character customization menu for real people by saying ""Tell me about yourself, are you a boy or a girl?"" to them. Only they get to choose what to change.",t3_iy0tl8,1600853411.0
259,"When you kiss someone, wherever you are, a pigeon will find you and shit on you.",t3_iy45kw,1600867187.0
260,Whenever someone says «I’m so hungry I could eat a whole (insert animal)» you can summon said animal and the person is forced to eat it.,t3_ixq629,1600818998.0
261,You do not have the ability to be able to,t3_ixwuat,1600839242.0
262,"You are the most Beautiful person alive, only when no one is looking",t3_iy3x99,1600866073.0
263,Every time you masturbate one of your friends will simultaneously cum with you,t3_iy29nu,1600858976.0
264,You change your gender after having sex.,t3_ixlkub,1600803063.0
265,"Whenever you say “Or is it?”, Vsauce music starts playing",t3_ixqyc6,1600821334.0
266,You get to choose your own power in the comments and I reply with side effects,t3_ixx5hq,1600840248.0
267,"You summon any object in front of you by scheming at the top of your lungs ""GIVE ME (insert object here)!""",t3_ixyibi,1600844945.0
