,0,1,2
532,You have the Ability to skip time when you are sleeping,t3_ivmejw,1600521308.0
533,ɹǝɓuɐp ǝʇɐᴉpǝɯɯᴉ uᴉ ǝๅᴉɥʍ uɐᴉๅɐɹʇsnɐ uᴉ ǝdʎʇ uɐɔ noʎ,t3_iur5uv,1600401662.0
534,You can shoot your teeth out of your mouth like a gun,t3_iv71ge,1600467933.0
535,"You’re immortal, only when you are orgasming though.",t3_ivo1q8,1600529286.0
536,You can make people you don’t like have nightmares about you,t3_ivkiyt,1600513341.0
537,Hotdog burp,t3_ivlk8p,1600517622.0
538,You can pee faster by physically widening your urethra with your mind,t3_ivjhyu,1600509270.0
539,You can steal other people's toes- transferring their toes directly onto your own feet,t3_ivhupg,1600503051.0
540,Everytime you sneeze the person closest to you does a backflip,t3_iv7gvv,1600469337.0
541,You can absorb and use other people's superpowers,t3_iv9yko,1600477212.0
542,"You can kill a whole species at will, and a random atomic bomb will explode.",t3_ivsi5e,1600550744.0
543,Whenever you get hit in the balls all men around you feel it as well.,t3_ivjolg,1600509956.0
544,You can change the name of this subreddit into r/shittysuperpowers and no one will remember what it was originally called,t3_ivcdtv,1600484883.0
545,You can go invisible only while no one is looking or can see you,t3_ivirkb,1600506536.0
546,Raising your hand as you would to request something..,t3_ivjvph,1600510724.0
547,Whenever you say “Is it possible to learn this power” you immediately learn it,t3_ivgaw0,1600497565.0
548,"Whenever you would fail a coin toss, you can instead gain ten pounds to have it succeed instead.",t3_ivm2iz,1600519856.0
549,"You can make anyone hum ""never gonna give you up""",t3_iv41bz,1600456016.0
550,"If you’re wearing a button up shirt, unbutton the middle button and reach inside, a time portal opens and you can touch your past self.",t3_iv4qmp,1600459328.0
551,You can speak in tongues.,t3_ivhnvk,1600502370.0
552,You can tie your shoes while running,t3_ivbly1,1600482389.0
553,You are gifted constant post-nut clarity.,t3_ivd1nv,1600486946.0
554,You can perfectly memorize the lyrics of any song you hate,t3_ivn966,1600525291.0
555,You can make anyone's game crash before they save it,t3_iv93rs,1600474556.0
556,You can control your crush's mind by crushing yourself in a trash compactor,t3_ivaf2g,1600478610.0
557,Your fart sounds like your lastly heard musical instrument.,t3_ivjt7l,1600510447.0
558,Anytime you sneeze a soft voice whispers ‘Bless you into your ear’ no matter where you are,t3_iv5gn9,1600462213.0
559,"When you're nervous, you see everyone around you bald",t3_ivkmwk,1600513775.0
560,You can turn traffic lights to red with your mind.,t3_ivhrjz,1600502734.0
561,You can tell if a gun is empty or jammed only after it fires,t3_ivir8j,1600506499.0
562,You can prevent yourself from immediately having to have to use the restroom after drinking a cup of coffee,t3_iv5q4s,1600463187.0
563,You can point to any location on a globe only when your eyes are closed,t3_ivjo1a,1600509897.0
564,You can sumion any thing or substance in a general location. The Catch is it can be ANY THING OR SUSTANCE and you have no idea what will appear or how much.,t3_ivj119,1600507553.0
565,You can see where other people are looking via 2 red lasers coming out of their eyes.,t3_ivc9bs,1600484475.0
566,"You can see what your dog is barking at, even from a few miles away.",t3_iv6w7k,1600467427.0
567,Eating an m&amp;m changes the colour of your piss into the colour of m&amp;m,t3_iv7j9j,1600469560.0
568,You can make people drop things except it only works on alternating tuesdays,t3_ivcpze,1600485953.0
569,You’re amazing at video games that you hate.,t3_iv6mfm,1600466519.0
570,You can speed up or slow down time,t3_iv912v,1600474313.0
571,You can synchronize with someone and manipulate him/her if you have to be naked and say I’m gay first.,t3_ivj9mw,1600508439.0
572,You have night vision...,t3_ivc3lc,1600483932.0
573,"You can make people get the urge to watch ""never gonna give you up"" volunteerily and in this way you can Rick roll people in real life.",t3_iv42il,1600456174.0
574,Whenever you flip someone off it’s censored in real life,t3_ivcpk7,1600485912.0
575,You excrete a random object from any orifice of your body every day.,t3_ivipnv,1600506327.0
576,"You can see through things once a day, during 12 seconds and after use your power you can't see nothing for 6 hours",t3_iv4111,1600455975.0
577,Your gaming skills are highly enhanced when playing mobile games.,t3_ivahcp,1600478815.0
578,You know exactly when a video game is going to be released/launched and get it 2 months early when pre-ordered.,t3_ivel2n,1600491956.0
579,You can make your knuckles bleed whenever you punch a hard object,t3_ivc3c0,1600483909.0
580,You speak Spanish when you're happy,t3_iv3d3r,1600452583.0
581,You can instantly cover you hands in raw chicken juice to wipe on your enemies,t3_iv706p,1600467803.0
582,You have the ability to bend kitchenware when you sneeze,t3_iva6cw,1600477845.0
583,"Projectiles and melee attacks will pause briefly right before they hit you, before continuing at their original velocity.",t3_iv4adp,1600457277.0
584,You can barf lava if you think about a freaky-looking scarecrow 10 minutes beforehand,t3_iv3ugr,1600455090.0
585,You can make your genitals sparkle by flashing people,t3_ivgdv7,1600497851.0
586,Every time you shit in a toilet the creator of the toilet can smell it,t3_iv5x54,1600463931.0
587,Your nerves can transmit signals to nearby people instead of yourself.,t3_iv11ls,1600439947.0
588,Your password is always expectable not matter the length or lack of symbols,t3_iv4u8k,1600459755.0
589,When you kill yourself you become invisible,t3_iv25vm,1600446022.0
590,You can make anyone who is sorting by new upvote your post,t3_iv435l,1600456269.0
591,Your teeth can bite clean through anything with ease,t3_iv05zr,1600435649.0
592,You can take any item from a video game,t3_iud03u,1600348492.0
593,You can hear animals insult you,t3_iv358j,1600451381.0
594,your hands have turned to sponge and you can suck whole lakes at a time. when you drain the sponge your hand break and you either have to suffer a hand break every few months or just have insanely wet hands all day,t3_iv8mwl,1600473107.0
595,"You have the ability to speak any language on earth, given you hate the people who speak it.",t3_iv57wo,1600461278.0
596,You have the power to turn any piece of paper in your field of vision into a shitty paper airplane that always nosedives.,t3_iv2f4y,1600447387.0
597,"Your blood can shift through the solid, liquid and gaseous states.",t3_iv4a55,1600457243.0
598,You know who made a number 2 in a bathroom by the smell,t3_iv5j86,1600462476.0
599,you can turn your teeth into chewing gum,t3_iv63e2,1600464587.0
600,"U are very good at shooting with a gun, This only works when you point the gun at yourself.",t3_iv07h0,1600435860.0
601,"You have the power to instantly change porn to a YouTube video whenever somebody walks in on you jerking off. Unfortunately, there is an error which gives the 10% chance of switching to hardcore midget porn.",t3_iuxwam,1600425701.0
602,You can convince anyone anything as long as you can get them to say poggers. The effect wears off after every use. It doesn't count if they say poggers without you telling them to/tricking them into saying it. Only works on one person at a time.,t3_iv2jqx,1600448074.0
603,You can print fake money with your fingers,t3_iv1lnt,1600442853.0
604,You have the ability to read minds for brief periods of time. This superpower is activated like a spore and appears in the form of cystic facial and body acne.,t3_iv26eo,1600446096.0
605,"You can move twice as fast, with half the energy..",t3_iv1ogz,1600443283.0
606,"You can let animals eat you and shit you out. After you’re out, you can become whole and repeat the process.",t3_iv0iin,1600437377.0
607,You can see a counter that says the number of words you have said in your life till now.,t3_iv0w5i,1600439203.0
608,You can make girls in your area have crush on you best friend,t3_iuzq8w,1600433578.0
609,"When you pee, you pee all of it. You never have that post-piss dripping anymore.",t3_iupnzi,1600397091.0
610,You can see 1 second of future,t3_iv0ef3,1600436819.0
611,You can peel off online advertisements from the screen.,t3_iuzdsz,1600431980.0
612,You can turn invisible if you cover yourself in vinegar,t3_iuvbqt,1600415677.0
613,You stop time every second your eyes are closed.,t3_iuw751,1600419085.0
614,You can redirect all piss streams at will,t3_iuxt5x,1600425343.0
615,You can play any national anthem at any time,t3_iut7ur,1600408134.0
616,Whenever you close your eyes you cant hear.,t3_iuo28z,1600392275.0
617,"You can turn any book that contains the word ""famine"" into a potato",t3_iuotav,1600394519.0
618,"When in serious danger, you can land a bottle flip perfectly every time!",t3_iuuyr6,1600414360.0
619,All of your vital organs are bulletproof. And they all weigh an extra 5lbs each.,t3_iuodmf,1600393200.0
620,If you tell I AM THE HULK in a area with more than 150 people in a 1 square kilometer area you gain gain the power of the hulk for 10 seconds,t3_iuvjcg,1600416494.0
621,"you can piss out of your fingers, if you pose it as a fingergun",t3_iuvdei,1600415855.0
622,.sdrawkcab daer nac uoY,t3_iuv4qf,1600414979.0
623,You can cause mass brain hemorrhages in a 10 foot radius around yourself,t3_iuv3ym,1600414901.0
624,"You can listen to exactly what your dog is thinking, though he/she thinks in barks.",t3_iukx3d,1600382904.0
625,You can make yams intelligent.,t3_iutpiz,1600409826.0
626,"Whenever you show anyone a picture, the disembodied voice of nickleback will sing ""look at this photograph""",t3_iur52f,1600401599.0
627,You can turn water into non-alcoholic wine,t3_iusrgp,1600406651.0
628,You can aim your fingernail clippings with 85% accuracy,t3_iuts1x,1600410074.0
629,You can get blood from a stone.,t3_iuu8vn,1600411734.0
630,Your pee is made of cum and your cum is made of pee,t3_iumvxy,1600388850.0
631,Your waifu becomes real once you get a girlfriend,t3_iutf4v,1600408816.0
632,Everytime you pop something it'll sound like bubble wrap.,t3_iuuelf,1600412299.0
633,"Every time you say ""I'm not that dramatic"", a glitter bomb explodes above you",t3_itvj6s,1600291860.0
634,You know exactly how the world works,t3_iuxgsz,1600423968.0
635,You have eyes at the back of your head. ONLY THE BACK OF YOUR HEAD.,t3_iumc55,1600387232.0
636,You can shoot skim milk out of your right nipple at 60 psi on command,t3_iuoaar,1600392926.0
637,Grass moves out of the way when you walk.,t3_iuqj7t,1600399721.0
638,Your items drop when you die.,t3_iuj6qd,1600377198.0
639,You can turn invisible yet you can’t become visible again,t3_iut03j,1600407419.0
640,You can slap people through the internet,t3_iuns18,1600391444.0
641,Blood tastes like water.,t3_iuqqza,1600400398.0
642,You can remember the value of pi upto 50 digits randomly and not in order.,t3_iufn6e,1600361255.0
643,Your driving skills are significantly increased when u drive a car with its engine turned off.,t3_iumide,1600387728.0
644,"When You close your eyes you can still see, tho everything is blurry, and in black and white.",t3_iulj9u,1600384800.0
645,You can drink your sweat. That's it,t3_iuqbr3,1600399078.0
646,"When you see the number 69, the smash brothers announcer voice will say nice.",t3_iuhjrg,1600370676.0
647,You can clean anything you touch,t3_iunu5l,1600391611.0
648,You can command my pet crab by sending a string of emojis under this post,t3_iuofu5,1600393367.0
649,"Whenever you get stressed, bubbles start coming out of your ears",t3_iuj5r2,1600377103.0
650,You can transform any normal food into its canned varient and vice versa.,t3_iumoc3,1600388213.0
651,"You have the power to dry the swampiest of asses, butt never have a dry ass of your own.",t3_iulrpv,1600385523.0
652,"If you run out of toilet paper when you're home alone, you can teleport a roll in to the room next door to the toilet",t3_iug4dn,1600363739.0
653,Making airplane noises lets you hover off the ground 15cm,t3_iubxpu,1600344056.0
654,You can play anything like a piano.,t3_iuluuq,1600385781.0
655,"Whenever you focus on a conversation, you get amnesia. Amnesia goes away when not focused on a conversation.",t3_ium8hf,1600386935.0
656,You Can Have Rabid Animals Bite Karens on Command,t3_iugzke,1600368043.0
657,You now can partially command rodents,t3_iudy5j,1600352897.0
658,"Every time you laugh, you immediately step in shit..",t3_iulp3f,1600385297.0
659,"Whenever you watch porn, your screen and selfie camera gets shared to all the women that you love cell phone or computer.",t3_iuouxl,1600394656.0
660,The smell of farts makes you horny,t3_iumul9,1600388735.0
661,You can change the color of your undershirt at will.,t3_iumh1d,1600387611.0
662,Bass boosted windows xp sound plays every time you say something stupid,t3_iufmkk,1600361162.0
663,You can tell the flavour of crisps just by looking at them,t3_iuhcua,1600369787.0
664,Your cum becomes blue when you're cheating on your partner.,t3_iug3mm,1600363630.0
665,You can make a random paper sticky by licking a rabbit.,t3_iuga6b,1600364531.0
666,"While watching porn, everytime you're about to jizz the guys face pops right up",t3_iufkr4,1600360893.0
667,When you enter a room you can use a powerpoint animation that transports you through the door,t3_iu8wsv,1600332815.0
668,You can turn into the lord of the flies and have flies worship you.,t3_iukjau,1600381678.0
669,Your boner can point to the the nearest serial killer or muscle lady,t3_iudwh7,1600352652.0
670,"By opening a door, you can open a portal to a random location in Kalmanstunga, Iceland.",t3_iucoxi,1600347154.0
671,You can like pictures on instagram with thought everytime you want,t3_iulvj8,1600385840.0
672,Porn Music Starts whenever take off any piece of clothing,t3_iuelbr,1600355991.0
673,"Every time you finish something,there is someone behind.",t3_iui2o1,1600372962.0
674,You will automatically say “I HAVE BONER” whenever someone passes,t3_iuhwce,1600372225.0
675,You can turn into pigeon poop that always misses that car or person by one inch (25.4 mm),t3_iukklk,1600381791.0
676,"If you think about dying, you die and make a perfect clone of yourself next to your dead body, and live on in the new body.",t3_iugd3t,1600364955.0
677,You ability is anti-Anatidaephobia.,t3_iuajrp,1600338785.0
678,You can boost all your stats 3x the normal,t3_iug68f,1600363990.0
679,"For every time you cough on your hand, anything you touch becomes bright neon pink.",t3_iubqeu,1600343265.0
680,You have the reflexes of a flie only when you are reading a book.,t3_iuk28h,1600380153.0
681,"When you point at a direction, the closest and smallest object in that direction will move aside.",t3_iufhj3,1600360414.0
682,"You can rename this sub to ""shittysuperpowers"" without anyone remembering it's former name",t3_iu4eqs,1600318239.0
683,"People fart when they’re around you and you can control the intensity and volume of said farts. ex. Lvl 1 - little poot, Lvl 100 - fart their soul out",t3_itjn1g,1600239331.0
684,You now trigger claustrophobia in people closer than 6 feet from you,t3_iudvoa,1600352544.0
685,You can make an eyelash get stuck in you eye whenever you want,t3_iudtls,1600352251.0
686,You can grow Shrek ears that immediately fall off and decompose.,t3_iucrx3,1600347513.0
687,You now can throw your voice,t3_iudqsg,1600351860.0
688,"When you say ""lunchables"" two big grown men will pick you up and take you home",t3_iu55yl,1600320386.0
689,"You can give everyone synesthesia and mix up everyone's motor functions of everyone in a 100 kilometre radius, including yourself.",t3_iug7fr,1600364157.0
690,Shitty Rules [Read before posting],t3_es5n7i,1579690068.0
691,"Any water gun you shoot fires actual bullets, while any real gun shoots water.",t3_izzgfn,1601124038.0
692,You now have the ability to make babies cry or shit on command.,t3_j00mg1,1601129026.0
693,You can make someone pee for you when you feel like peeing.,t3_j00192,1601126452.0
694,You can predict the end of a movie though it takes as long as the movie itself to to that,t3_iztyol,1601103050.0
695,You can tell if a person is romantically interested in you but only after you shit your pants in front of them,t3_izw0q5,1601110629.0
696,You can lift your balls with YOUR MIND!,t3_iz7qv3,1601016723.0
697,"For every full bottle of dried oregano you eat, you can shoot fully cooked spaghetti out of your fingertips for up to an hour",t3_izqrsy,1601092755.0
698,"When you wake up from a dream, you wake up in the exact same location as the one in the setting of your dream.",t3_izxcsa,1601115781.0
699,you are now Florida man,t3_izzzqi,1601126260.0
700,you have wings that are controlled by your boner,t3_j0179j,1601131774.0
701,You can make people forget that you have this superpower.,t3_izr290,1601093647.0
702,You can turn yourself inside out,t3_j003ip,1601126720.0
703,The ability to stare directly at the sun without blinking.,t3_j001j6,1601126483.0
704,You can add a second to your lifespan by wearing a robe for a year.,t3_izx9ah,1601115384.0
705,You can switch places of your legs.,t3_izx33v,1601114726.0
706,"When you’re happy and you know it, you make other people clap their hands",t3_j02f42,1601137850.0
707,Your vision is constantly zoomed in,t3_izw0gp,1601110602.0
708,Everytime you break a bone you get a five dollar discount on every store you go,t3_izwbpw,1601111792.0
709,"Your farts smell like perfume, except that you need to be naked while farting.",t3_izxkk5,1601116612.0
710,You can time travel. To do so you must shit your pants and you can only travel to a point in the past that you also shit your pants.,t3_izwv5g,1601113896.0
711,Any sentence you post in r/Shower thoughts will instantly become so complicated that people can only assume it's something vaguely like an actual shower thought,t3_izyqo9,1601121177.0
712,To make your belly button actually talk,t3_izv3af,1601107156.0
713,You can roll up the skin on your arms like sleeves,t3_iz2952,1600999222.0
714,You can permanently disguise as someone by sneezing on them,t3_izxreq,1601117360.0
715,"You can now talk to plants, keep in mind the plants won’t talk back",t3_izvhbd,1601108574.0
716,you can tie shoes really fast,t3_izxbfk,1601115628.0
717,your spit can be used as a weak detergent,t3_izxayj,1601115573.0
718,You now can swap heads with a fly,t3_izsgpo,1601098137.0
719,You are what you eat.,t3_izrmfn,1601095421.0
720,You can vomit on command,t3_izp43j,1601087704.0
721,You have the power to feel the pain that the ground feel When u step in it,t3_izwvit,1601113936.0
722,Your urine turns things gold,t3_izsk4q,1601098451.0
723,You can teleport anyone anywhere with a rotten dish of their favorite food,t3_izvomk,1601109343.0
724,You can change your ethnicity by the types of foods you eat,t3_j00y5c,1601130533.0
725,Any cavemen near you will automatically die.,t3_izo3ko,1601084559.0
726,You can summon a thick sphere of seran wrap around a racist's head at will.,t3_izuph1,1601105727.0
727,You age five years each time you talk in Old English,t3_izximc,1601116398.0
728,You know every answer to every test when you moan really loud,t3_izgww4,1601057523.0
729,You can prevent rain from happening when going out carrying an umbrella,t3_izv8um,1601107713.0
730,You can make people use the metric system,t3_izldjf,1601076013.0
731,You can out-obvious Captain Obvious. Obviously.,t3_j00dx3,1601127978.0
732,You can turn off friction for yourself at will,t3_izu29n,1601103394.0
733,You can make others hear food screem when you consume it,t3_izseov,1601097947.0
734,You can turn into a bush,t3_izh2b5,1601058411.0
735,You can be invisible only when you masturbate,t3_iztm2t,1601101868.0
736,"Every time someone tries to read your mind, your thoughts instantly switch to oppa gangnam style",t3_iz7two,1601017027.0
737,You can telepathically Rick Roll,t3_izrzms,1601096588.0
738,Everything you eat taste like choco-mint.,t3_j02klg,1601138624.0
739,You always know why a helicopter is flying overhead,t3_izly80,1601077862.0
740,You now can talk to plants,t3_izsi1x,1601098258.0
741,Your foreskin comes all the way back &amp; you can take your entire skin off.,t3_izhvh3,1601062707.0
742,You can turn dead frogs to stone,t3_izj0t4,1601067759.0
743,"If more than 50 percent of your fart enters a persons lungs, they fall in love with you on the spot.",t3_izt5oe,1601100390.0
744,You can piss ants which will proceed to march to the nearest chicken and swarm it,t3_izss27,1601099175.0
745,You have the power to read your own mind!,t3_iznbeq,1601082143.0
746,You can know who the imposter/s is/are in Among Us.,t3_iztiys,1601101582.0
747,"Every time u click ur mouse button, you earn 0.001$.",t3_izp4yn,1601087773.0
748,Spiderwebs will glow so you can see them 7 inches away from you,t3_izuj3m,1601105081.0
749,You can speak any language.. butt every sentence you speak has to end with that language’s translation of “no homo.”,t3_izqc16,1601091403.0
750,"You can point at someone and make their skin any color you want, or make it see-through so their insides are showing.",t3_izu412,1601103574.0
751,"By kissing someone on the lips, you can pop a dollar out of your ass",t3_izl13t,1601074911.0
752,Having the ability to smell an erection within 27 yards,t3_izsjjv,1601098394.0
753,You know the name of anyone you touch,t3_j00r5j,1601129618.0
754,You can lure the closest ambulance when you shit your pants.,t3_izh7fn,1601059206.0
755,You can make any towel of your choice wet with the snap of your fingers.,t3_izs2r2,1601096864.0
756,You can read peoples minds when they think negatively of you,t3_j00fyt,1601128225.0
757,"You can instantly grow any plant, and as soon as it comes into contact with semen, it explodes and leaves behind a turtle, which will die after 4 seconds",t3_j00bzc,1601127743.0
758,Everytime you close your eyes you cant see.,t3_izuqd2,1601105818.0
759,You can think of all the puns you could make in a conversation,t3_j003ef,1601126708.0
760,Your butthole works like a Chinese finger trap.,t3_izrj9f,1601095129.0
761,"Every time you blink, a random person in your country poops",t3_izsq6j,1601099004.0
762,You can speak every language and don’t understand what you or others are thinking/saying,t3_izsmux,1601098693.0
763,You body will turn to dried leaves when you die.,t3_izr93r,1601094254.0
764,You can become invisible when you have more than 100 living spiders on your skin,t3_izorq3,1601086642.0
765,"When eating food that you dip into a condiment, you always finish both with no leftover.",t3_izofzy,1601085635.0
766,You can hit your head on a wall 4 times before it starts hurting.,t3_izm3s6,1601078353.0
767,You can instantly infer context from any quote or reference made within your hearing.,t3_izpf9w,1601088636.0
768,You can summon the band Smash Mouth to any viable location for a pop-up concert!,t3_izgbd2,1601054039.0
769,"You’ll be super smart at math though you’ll be incompatible to read, talk and write when u use the ability",t3_iznnkb,1601083182.0
770,You can find anything that you can see.,t3_izxxfy,1601118046.0
771,All your pets have 9 lives,t3_izrmv9,1601095457.0
772,You always get a 1% discount on all the rugs you buy,t3_izrjtj,1601095181.0
773,You can stop sand from getting between your toes if you complain about it,t3_izoa7h,1601085127.0
774,Playing the flute like a snake charmer will make any ants in the surrounding area slightly dizzy.,t3_izoa6t,1601085126.0
775,You can walk through closed doors only if they’re also unlocked,t3_izn3n0,1601081475.0
776,Stepping into sunlight sets a random thing on fire,t3_izphzh,1601088865.0
777,You can make yourself 10% more likely to be struck by lightning.,t3_iz8nlj,1601020043.0
778,You can eat 100 year old eggs without getting sick and you actually like them,t3_izpeup,1601088601.0
779,You can delete other peoples comments.,t3_izlxk2,1601077800.0
780,You can puke blood at your will.,t3_izexyn,1601046289.0
781,"Whenever you're horny, you can summon any character, fictional or not, and it will always have an appearance that'll turn you off.",t3_izl3qo,1601075131.0
782,You run 10% faster while you're masturbating.,t3_izezhq,1601046528.0
783,"You can go 60 seconds into the past, by swinging all the way round on a swing set.",t3_izf8z3,1601047981.0
784,You can lift one pound more than the weakest person in the room.,t3_iznifz,1601082731.0
785,"You can see in the dark, only if you close your eyes",t3_izdquc,1601040276.0
786,You can throw your eyelashes like boomerangs,t3_izfc41,1601048440.0
787,You become bulletproof after you get shot,t3_izmep7,1601079310.0
788,You can make your feet shrink.,t3_izm7zp,1601078713.0
789,You can walk through walls and your cloths cannot.,t3_izf0gf,1601046675.0
790,"You see, hear, etc. 2 seconds in the future. You can't see the ""now"" while this ability is active.",t3_izltnu,1601077440.0
791,You can see throught mask,t3_izjupn,1601070935.0
792,You can instantly change all of the m&amp;ms in any bag of trail mix to skittles.,t3_iz8kud,1601019758.0
793,You can make people believe you're a meth-addicted street beggar anytime you want.,t3_izl18v,1601074923.0
794,You can teleport your toenail clippings,t3_izk6nr,1601072105.0
795,There is a 50% chance you get an erection if the teacher asks you to stand up,t3_izk6gk,1601072085.0
796,"For every giant glass of milk you drink, your bones are indestructible for 1 hour. For every galloon of milk you can grow 1 bone wherever you want.",t3_iz8qjt,1601020342.0
797,You are an earthbender though everyone else is a avatar,t3_izjmpe,1601070131.0
798,Can't do title BC not creative,t3_izgo96,1601056138.0
799,The sound of your sneeze is replaced by a loud and long moan.,t3_izeypa,1601046401.0
800,You can command dragons. Too bad there are no dragons in your lifetime.,t3_izey2i,1601046307.0
801,Each time you punch someone,t3_izb2ho,1601029078.0
