,0,1,2
268,"Everytime you sneeze, you teleport, you cant control your sneezes or where you teleport to.",t3_ixvm10,1600835384.0
269,u can teleport flat-earthers to space so that they can see for them fucking selves,t3_ix90wt,1600750141.0
270,"You have the ability to talk to any animal, as long as that animal is extinct.",t3_ixsw16,1600827183.0
271,Finding Nerf darts as easy as you lose them.,t3_ixtkkn,1600829214.0
272,You can turn invisible while singing “This is the song that never ends” at the top of your lungs,t3_ixwvb1,1600839329.0
273,You can transform to a rock when you're 600 feet deep in the Bermuda Triangle,t3_ixi8mm,1600785274.0
274,"Everytime you go to sleep, a baby animal will cuddle with you.",t3_ixv9g6,1600834308.0
275,You can jump 6 feet in the air. You cannot jump any higher or lower.,t3_ixxmcg,1600841806.0
276,Everything goes in and out the same hole. EVERYTHING,t3_ixvl88,1600835310.0
277,You can literally talk out of your ass,t3_ixmx53,1600808485.0
278,"On drop down menus where you select your state during online checkout, you can always spin it to exactly your state.",t3_iy2e8b,1600859487.0
279,You win every armwrestle at the cost of shitting yourself,t3_ixoduf,1600813514.0
280,"When you hold your breath, you can fall through water like it is air.",t3_ixj23u,1600789635.0
281,You can make needles come out of your fingertips like wolverine (you are not immune to the pain they cause),t3_ixtbc0,1600828444.0
282,Naruto run grants 30% speed increase only when you're being filmed,t3_ixr5q9,1600821921.0
283,You can play any wildly inappropriate song on any instrument with perfect vocals any time.,t3_ixqy7v,1600821324.0
284,"Every time your poop weighs more than 5 ounces total, someone’s bud light is replaced with pineapple juice",t3_ixp4lr,1600815872.0
285,You have the ability to stop seeing sperm/sex/nut posts,t3_ixndmu,1600810102.0
286,You can make your enemy google search result always start from the last page,t3_ixqvql,1600821115.0
287,"You have super speed, it can only be used when your eyes are shut",t3_ixw313,1600836864.0
288,The ability to learn and play any song in the world on guitar at request.,t3_ixrm8u,1600823315.0
289,You can easily catch fish with your bare hands while in a metropolis,t3_ixte2p,1600828670.0
290,You can change alcohol into water.,t3_ixppoa,1600817653.0
291,"You can take any counterfeit money you find, (has to be realistic money so no Monopoly money) and turn it into real money.",t3_iy30ay,1600861970.0
292,You can open any type of door if you have 40 thieves with you.,t3_ixnihv,1600810577.0
293,You can eat and digest diamonds,t3_ixk92l,1600796471.0
294,Every door you walk by you get your shirt caught on the handle,t3_ixq4pf,1600818896.0
295,You can turn your cat into a dog anytime you need to dispose of leftovers,t3_ixsngn,1600826489.0
296,You always have a $5 bill on your person,t3_ixrgx9,1600822886.0
297,You can super-junp by generating a wildly powerful blast of air beneath your feet.,t3_ixv7pz,1600834160.0
298,Bean Bender. You bend beans. That's it,t3_ixh50s,1600779972.0
299,"You literally shit money. Brand new, balled up bank notes come out of your bottom.",t3_iwtvf7,1600692834.0
300,Your diaries write themselves as you go about your day.,t3_ixg8rq,1600776086.0
301,You piss the net weight of Niagra Falls,t3_ixuwhq,1600833223.0
302,You can teleport anywhere after counting to 1 million with no interruption,t3_ixdzx4,1600767278.0
303,"In russian roullette, you have an 5/6 chance to survive.",t3_ix6g66,1600742527.0
304,"You think so fast, that everything seems to be in super slomo for you. You cant switch it off so you have too stay in class for a loooong time.",t3_ixlf8p,1600802341.0
305,You can open a water bottle flawlessly,t3_ixnn47,1600811017.0
306,"For every 100 TikTok videos you watch, a random TikToker dies.",t3_ixijkf,1600786913.0
307,You have the ability to poop with such immense force that you can unclog a toilet.,t3_ix8bbn,1600748014.0
308,"No matter what happens, you don't smell like anything.",t3_ixh3o9,1600779804.0
309,You aren't able to...,t3_ixw1s8,1600836754.0
310,"Every time you take a shit, it points in the direction of buried treasure.",t3_ixh8bk,1600780389.0
311,You can give yourself/others backpain,t3_ixue35,1600831658.0
312,You can’t overdose on vitamin gummies anymore,t3_ixex5o,1600770785.0
313,"Whenever you have a song stuck in your head, everyone in close proximity can hear it.",t3_ixbyxv,1600759840.0
314,You can fart the price of venti Pumpkin Spice Latte.,t3_ixfltn,1600773515.0
315,You can only get hard by sucking your nuts in and make at her people hard when you don’t suck your nuts in,t3_ixsc9c,1600825554.0
316,"Everytime an awkward silence happens during a conversation, 90’s elevator music will come from your mouth if you keep it opened",t3_ix2tdo,1600731591.0
317,You shoot rainbows out of your hands that turns people gay,t3_ixbsl3,1600759211.0
318,Everytime somebody comments on your height you grow .1 mm,t3_ix3kgf,1600733979.0
319,"Whenever you are hungry, a can of baked beans will spawn right next to you, regardless if you want them or not",t3_ixmyyi,1600808653.0
320,You can make your crush like anyone except you,t3_ix1a96,1600726696.0
321,You get an alert whenever someone's mom is about to beat their ass.,t3_ixdbhf,1600764744.0
322,"You can talk to any God, except he doesnt talk back",t3_ixgbau,1600776368.0
323,"You can cause anyone within a closed area that you're also in, to fart simultaneously",t3_ixgu9d,1600778618.0
324,"You can fly, execpt only upwards.",t3_ixj7i4,1600790462.0
325,You can break blocks in minecraft by punching your monitor,t3_ixiah1,1600785545.0
326,When you hold your breath you float up like a hot air ballon.,t3_ixg9si,1600776196.0
327,Your food out of the microwave is always partially cold,t3_ixfdws,1600772636.0
328,You can make your skin invisible.,t3_ixbw4z,1600759553.0
329,"You can summon a magic blue shelf that can't be touched, and disappears after 2 minutes.",t3_ixipbk,1600787750.0
330,"Every time you take a shit, you gain one cent.",t3_ixct1b,1600762826.0
331,You can drink like using a straw without any straw.,t3_ix2tl3,1600731610.0
332,When you look at a tree you know the exact amount of leaves.,t3_ixg7ya,1600775997.0
333,You can sleep with your eyes open,t3_ixhlwq,1600782132.0
334,You are able to know what someone's last name would be if all their ancestors got their last name from their other parent,t3_ixobs3,1600813332.0
335,"You can summon a dog that sings thomas the tank engine theme song, everytime you are in a intense situation.",t3_ixhigu,1600781680.0
336,Every time you punch a tree there's a 50% chance you'll hear the minecraft theme,t3_ixfxoh,1600774839.0
337,You have the power to work any shower handle instantly.,t3_ixgb30,1600776345.0
338,"You morph into Koolaid man anytime you say ""Oh yeah""",t3_ixiy1t,1600789024.0
339,In the game Among Us you can always get the admin card swipe on your first try,t3_ixgvji,1600778787.0
340,You can stand your own voice in recordings,t3_iwur3i,1600696922.0
341,"While watching a movie, whatever outcome you thought would happen, happens.",t3_ixgigh,1600777200.0
342,You can make dead meme sounds when you try to vocalize them,t3_ixet9u,1600770363.0
343,"Once per day, you can cause someone's piss to smell like asparagus at will.",t3_ixd7xj,1600764378.0
344,"Clapping instantly turns all of the money under your name into reddit karma, additionally, once you clap once it’s turned on indefinitely and any money you earn henceforth is automatically karma",t3_ixfjyi,1600773304.0
345,Your pee removes impurities from water in any container and makes the water fit for human consumption.,t3_ix65az,1600741681.0
346,You can do the opposite of what ever your Reddit username is,t3_ix85x9,1600747569.0
347,The only time you can sleep is after sex.,t3_ixgyuq,1600779202.0
348,Every time you jump the height you jump doubles from the previous jump,t3_ixco5o,1600762330.0
349,"Everytime you say what type of doritos you like most, you can change your nose to be a coffee dispenser and vice versa.",t3_ixgnfo,1600777804.0
350,Your genitals sounds like maracas white every motion.,t3_ixcb5y,1600761028.0
351,You are invincible also you will be fully aware of your own breathing for ever.,t3_ixkkul,1600798187.0
352,every time you sneeze there’s a 1% chance that you dont,t3_ixb6q6,1600757060.0
353,"You can visualise all your alternate realities, when you’re at a crossroads in life, at will, the one that makes you the happiest in the future then can’t happen",t3_ix9rp4,1600752392.0
354,"While in a hospital waiting room you'll hear the Doctor Mario title theme from the NES version of the game. Once you get called into the doctor's office the frantic music will play if its for something serious, and the chill music will play if its for anything unurgent.",t3_ix8ezc,1600748318.0
355,you can know whoever read your Reddit post as long as their name starts with the letter I,t3_ix9wm5,1600752816.0
356,"Every time you sneeze, a phone somewhere in the world gets fully charged.",t3_iwwwtr,1600708079.0
357,"Every time you blink, a random person explodes",t3_ix1rnc,1600728277.0
358,You can turn your pimples into skittles,t3_ix6s44,1600743517.0
359,You can turn all stray hairs in the room that you are in into a hairball that gets thrown up by the nearest living creature that can pass it without trouble.,t3_ixenui,1600769772.0
360,You can perform Baby Shark perfectly well in every instrument known,t3_ix4i1r,1600736714.0
361,you have extremely flammable skin,t3_ix8xzk,1600749891.0
362,You can sense disease in people even though cannot articulate it to warn them,t3_ix3of2,1600734302.0
363,By saying pickles in discussion time you can see the imposter in among us,t3_ix44ip,1600735605.0
364,Everything you touch is cake.,t3_ix4fjl,1600736506.0
365,You understand animals talking trash about you.,t3_ix6tl1,1600743635.0
366,You can turn valuable objects into fruit,t3_ix2r1m,1600731394.0
367,You have the power to blink at the speed of light,t3_iwyin2,1600716201.0
368,You can transform your organs into liquid without side effects.,t3_ix0qvb,1600724880.0
369,Ability to bend your own sweat.,t3_iwycuu,1600715452.0
370,Everytime you you jump you can levitate for how long your in the air for.,t3_ixauml,1600755926.0
371,You can make any gun your currently using malfunction/misfire in anyway possible.,t3_ix910c,1600750149.0
372,"You can automatically sense where important objects are when you loose them, like your keys, wallet, or phone, but everytime you do you get a horrible migraine that lasts the whole day (and no you can't control the sense)",t3_ix8vb8,1600749674.0
373,All of your reddit posts are successful on the 21st night of September,t3_ixbexo,1600757864.0
374,You have a keyhole in your chest and abdominals that can be opened to access a pocket dimension about their size. Any vaguely stick-shaped object can open them.,t3_ix0qwe,1600724884.0
375,You can speak all lenguages mixed together.,t3_ixgwgh,1600778896.0
376,You can make people's spoons fall into their soup/sauce,t3_ix6sw8,1600743586.0
377,"Everytime you dont like someone, there is a 50% chance all of your pounds get turned into jelly beans... it has to be pounds, if you dont have any then consider yourself lucky.",t3_ixgqiz,1600778164.0
378,"You constantly feel like you’re busting to piss, though you never actually need to piss",t3_ix7o90,1600746122.0
379,You can sneeze out cum,t3_iwy2th,1600714107.0
380,You can make your blood clot at will,t3_iwyswd,1600717499.0
381,You can turn vegans into cooked steak,t3_ixceex,1600761365.0
382,Every time you take a step you have a 5% chance to shit yourself,t3_iww31l,1600703662.0
383,You can look through Pewdiepie's eyes for 5 minutes.,t3_iwyi0v,1600716124.0
384,You can beat people to make them work better,t3_iwx7gz,1600709687.0
385,"You have the ability to make yourself look muscular, though your strength is very weak.",t3_ix2x47,1600731912.0
386,You can travel through parallel universes and every time you jump a universe your existence from the universe you just left is erased in a way no one will ever believe you.,t3_ix2bi0,1600730034.0
387,"For every dollar you make, the person you hate most gets 5",t3_ix225s,1600729224.0
388,"When you flip a coin,there's a 65.3% chance it'll land heads",t3_iwvh22,1600700605.0
389,Phone text look up spokeo,t3_ixcpzr,1600762519.0
390,You can only turn legos into jelly AFTER stepping on them,t3_ixce2q,1600761327.0
391,You can absorb a teaspoon of water,t3_ix1pg5,1600728078.0
392,"You can go back in time 5 seconds, sadly there’s a 5 second cooldown",t3_iwv8xu,1600699432.0
393,You turn the temperature of anything you look at.,t3_iw50wh,1600594971.0
394,Anyone you hate will forever get the liquid ketchup first,t3_iwtt9j,1600692575.0
395,you can now use 100% of your bodies capability,t3_iww898,1600704399.0
396,When ever you eat pork you turn into a pig,t3_iwre23,1600682626.0
397,You can pukea out small bits of playdoh,t3_ix2aqg,1600729963.0
398,You can turn cows into 3 gallons of milk.,t3_iwpjst,1600675665.0
399,You can move water only a glass full every other hour.,t3_iwrwj9,1600684647.0
400,You can increase the friction of whatever you grab.,t3_iwtq51,1600692190.0
401,"If someone asks you a question while there is food in your mouth, hold music will play until you’ve swallowed.",t3_iwptmd,1600676634.0
402,You can turn shampoo into yogurt.,t3_iwppgq,1600676216.0
403,You can undigest what you eat and eject them through your mouth.,t3_iwsq14,1600687945.0
404,"The louder you yell, the faster your soundwaves travel.",t3_iwtv6b,1600692804.0
405,Every time you need to bake something you turn the oven to the correct temp without knowing it.,t3_iwqx0z,1600680751.0
406,You can paste what you copy online onto physical posters.,t3_iwsrpj,1600688142.0
407,"You can ""throw"" your farts so everyone will think someone else farted instead of you",t3_iwnlin,1600669139.0
408,You slurp the zippers off clothing like spaghetti,t3_iwrdze,1600682618.0
409,Whenever you eat toast you can turn into a toaster for an hour,t3_iwrfuq,1600682815.0
410,You dont need to wipe your ass after you take a shit.,t3_iwkmoi,1600659650.0
411,Each of your fingers have their own consciousness.,t3_iwmq16,1600666321.0
412,"When you orgasm, you cum chloroform for 10 straight minutes.",t3_iwnp7m,1600669464.0
413,"You are able to conveniently take out 20 dollars (coin or dollar bill) of the current country you are in from your pocket(s). You can do this every hour, and the counter only resets when you have already gotten 20 dollars out.",t3_iwlgsr,1600662204.0
414,You're slightly stronger than you look,t3_iwlskg,1600663278.0
415,While it is 38 degrees F you can create napkins and sporks out of thin air.,t3_iwlf4a,1600662063.0
416,"Whenever your heart rate exceeds 100 bpm, boss music starts playing",t3_iwggma,1600646435.0
417,You have immortality except if you die you stay dead,t3_iwmy46,1600667041.0
418,"Your prostate becomes extremely sensitive, so you will feel sensual pleasure whenever you defecate.",t3_iwhk1v,1600649930.0
419,You can make other people not capable of taking off their clothes,t3_iw5p1d,1600597710.0
420,Everytime you touch any type of liquid it turns into literal cum.,t3_iwl1q1,1600660912.0
421,It’s impossible for you to be cancelled about anything related to cats,t3_iwsbck,1600686269.0
422,You can turn gold into copper.,t3_iwkseg,1600660132.0
423,You can enlarge your shit up to 2.5x size,t3_iwi1a5,1600651469.0
424,You have the ability to become invisible to ants and only ants.,t3_iwiwyc,1600654237.0
425,You can make people sneeze by thinking about them,t3_iwka05,1600658573.0
426,Every year on your birthday you become a random age in your life.,t3_iwh3z1,1600648506.0
427,You can summon anything as a downgraded cheap version.,t3_iwkh9u,1600659191.0
428,You can ALLWAYS find the needle in the haystack.,t3_iweacm,1600639006.0
429,You can make irremovable graffitti with your piss,t3_iwct61,1600632954.0
430,"You can make wheelchair entrances disappear, along with anyone currently on them",t3_iwcsje,1600632876.0
431,You can get popcorn kernels out of your teeth with just your tongue.,t3_iwksvt,1600660169.0
432,You have the power to travel forwards in time,t3_iwf8nf,1600642387.0
433,When you hear someone or something you see subtitles in front of you,t3_iwf4zn,1600642045.0
434,You can turn any leaf into a crunchy leaf,t3_iwapsw,1600622428.0
435,"You get an ceiling fan everytime you snap, EVERYTIME!",t3_iwg43v,1600645315.0
436,You hear music backwards if you wear headphones the wrong way,t3_ivp8si,1600535571.0
437,Everything you touch with the palm of your hand gets stuck for 10 minutes,t3_iwejzn,1600639990.0
438,"You command the tides, yet they don't listen.",t3_iwfk4k,1600643471.0
439,you have grease-proof hands while eating and playing video games.,t3_iwb1j6,1600624064.0
440,You can make someone’s face mask become loose,t3_iwg1f7,1600645068.0
441,You can store things in your cheeks like a chipmunk,t3_iwein0,1600639851.0
442,You can summon a grandma to cook for you if your hungry.,t3_iwf9l7,1600642476.0
443,You can turn peoples chocolate chip cookies into raisin cookies,t3_iw9jy1,1600616709.0
444,you can make anyone’s sock slip off into their shoe,t3_iwaxoh,1600623553.0
445,"Every time you blink, a random person loses a brain cell",t3_iwa6dj,1600619753.0
446,"When you look at a globe or a map in a specific spot, the people there get a feeling that someone is watching them",t3_iw5tf1,1600598212.0
447,You can fly when nobody is looking at you,t3_iwb1yb,1600624121.0
448,You have the ability to turn any conversation into a bad Japan dubbed series,t3_iwbha3,1600626271.0
449,"You can detect simps, once you do u must terminate them",t3_iwcv96,1600633221.0
450,You physically can't wear clothes the wrong side around,t3_iw6zbw,1600603346.0
451,red bull actually gives you wings,t3_iwb8bb,1600625019.0
452,You can take the vitamin C from anyone you touch,t3_iwaxns,1600623550.0
453,When you listen to a song the lyrics will appear in front of you in chinese,t3_ivrllp,1600547013.0
454,"You shit gold, but it's in the shape of really sharp thorns.",t3_iwb7ii,1600624916.0
455,On every full moon night you can walk 10% faster vision decreases by 10%,t3_iw8ptw,1600612142.0
456,You can turn an orange into a grapefruit by lightly squeezing it,t3_iw7vwa,1600607607.0
457,"Once a week, you can choose to make any person irrationally angry at you to the point where they try to kill you.",t3_iw13ge,1600579469.0
458,"You are able to perfectly estimate any distance as long as it’s measured in weird units like bananas, overgrown toenails, lipstick tubes, etc.",t3_iw78jx,1600604519.0
459,Your opponents bone also breaks everytime you break a bone in your body,t3_iw8onz,1600611940.0
460,You can control every power in this subreddit,t3_iw9jhd,1600616641.0
461,You can turn invisible only while singing John Lennon’s Imagine.,t3_iw8v12,1600612929.0
462,You get a Wendy's coupon each time you cut off your limb,t3_iw7m66,1600606347.0
463,"Each time you point finger guns at somebody, that person instantly disappears, along with any memory of them or any record, including yours",t3_iw6x77,1600603077.0
464,Every meme you look at gets 10% increased funny and 10% less popular,t3_iw8mvu,1600611661.0
465,"C418 Sweden will play in your head everytime you become nostalgic. The more nostalgic you are, the louder is becomes until it is an earrape.",t3_iw5tbo,1600598199.0
466,"When you throw something and miss your target, you teleport over to the object.",t3_iw5zmt,1600598952.0
467,Condoms become sentient to you and insult you constantly.,t3_iw716e,1600603575.0
468,You won’t ever get speeding tickets as long as you’re driving at least 50 km/h over the posted speed limit,t3_ivyre6,1600571433.0
469,You have bone claws like wolverine,t3_iwahw1,1600621300.0
470,"If you place your hand over a blade, it switches places with the hilt.",t3_iw6e43,1600600713.0
471,"You can tell the amount of US people in a radius of 10 m every time you say ""America"".",t3_iw67oc,1600599925.0
472,You can make people remember you for the stupidest thing you did in front of them.,t3_iw55q6,1600595513.0
473,The quieter it is around you the more you can ear.,t3_iw3bma,1600588150.0
474,Laser eyes that never turn off,t3_iw9f1l,1600615995.0
475,"You can fly, clone yourself, stop time, have no need to sleep, eat or drink",t3_iw2w71,1600586433.0
476,"Whenever you say ""What are you doing, step bro/sis?"" your step sibling suddenly shows up.",t3_iw3j77,1600588962.0
477,"You get a wand that you can use to print the word “Pinhead” on the forehead of anyone not wearing a mask, not enforcing social distancing or pulling down their mask to cough or sneeze",t3_iw6duv,1600600680.0
478,You can break anyone’s bone by breaking your own bone,t3_ivbvy2,1600483271.0
479,You can prove that anyone does not have a superpower.,t3_iw9dw8,1600615833.0
480,"Whenever someone speaks to you in a language you aren't fluent in, subtitles show up on their genitals",t3_ivzznc,1600575538.0
481,If you make someone annoyed someone else in the world has their biggest life saving luck,t3_iw0ina,1600577351.0
482,"If you drink more alcoholic units than your age in a single day, your brain power increases by 0.01%. Replicable daily.",t3_ivq6u3,1600540410.0
483,The ability to summon any sound effect in order to perfectly describe a situation.,t3_ivxfze,1600567246.0
484,Your shadow has a mass of one gram.,t3_iw603q,1600599008.0
485,You can breath under water and you also die when you touch water,t3_ivzz0b,1600575478.0
486,"If you live to 150, remain a virgin and have a child, then you get 1 Reddit coin.",t3_iw4duw,1600592386.0
487,You only dream about nightmares,t3_iw415j,1600590924.0
488,You are able to fall asleep instantly if at least ten other people are sleeping near you.,t3_ivysbf,1600571519.0
489,Any metallic object you touch instantly turns into play dough,t3_ivw22f,1600562841.0
490,"Everytime you get hurt, onions around you start crying",t3_ivthrf,1600554448.0
491,You can talk to sports equipment.,t3_ivx1b2,1600565948.0
492,you can summon an ace attorney-style popup whenever you shout something,t3_ivzmm9,1600574291.0
493,When you kiss someone you immediately start spewing acid out of your mouth,t3_ivxcn7,1600566939.0
494,Whenever you think of a place you immediately know how to get there.,t3_iw1pbo,1600581779.0
495,"You have the constant ability to see exactly where every worm within 10 kilometres of you is, and what they are doing. It’s all you could ever focus on.",t3_iw63sd,1600599464.0
496,"You can resurrect dead people, they can only be murderers, seriel killers and dictators",t3_ivvk0b,1600561222.0
497,Everytime you nod or wave at someone in a car their car accelaterates at 100mph,t3_iw4423,1600591260.0
498,"You are ""Frijombre"", you shoot frijoles from your hands",t3_ivwwul,1600565561.0
499,You can sing I want it that way perfectly only that song,t3_ivx3pe,1600566159.0
500,You can telepathically control dirt,t3_ivtwdy,1600555831.0
501,You can swap bodies with things that can’t mentally fight back.,t3_ivxw47,1600568695.0
502,You can use your mind control powers on every blade of grass in the world,t3_ivq67c,1600540325.0
503,If you're peeing at urinals with no divider you can force your neighbor to make direct eye contact with you,t3_ivw83l,1600563382.0
504,You can perfectly flip a light switch to balance in the middle every time.,t3_ivw7ou,1600563345.0
505,You Have The Ability To Turn Into A Rock Permanently,t3_ivpm91,1600537467.0
506,"Once a day at random, you can telepathically communicate with the nearest plant.",t3_ivp1bw,1600534513.0
507,You can stop time or skip time,t3_iw434u,1600591150.0
508,You can resize any part of your body to any size very slowly. The cooldown is 1 day and you can resize it at any time of day until 12:30 AM.,t3_ivulcz,1600558099.0
509,You're able to tell if someone is a liar by licking their cheek,t3_ivkvzt,1600514784.0
510,You can only type on a stenotype,t3_iw6e6f,1600600722.0
511,You can cut your own skin with fallen leafs,t3_iw67ed,1600599895.0
512,"You can see a number with exact measurements, in a number system of choice, over everyone's heads, of a shit they taken exactly 8 years ago",t3_ivuty5,1600558863.0
513,"Everytime you say ""This day can't be worse"" bird poop will somehow fall in your mouth.",t3_ivwauu,1600563632.0
514,You can stiffen paper.,t3_ivrpjl,1600547483.0
515,Everything you push becomes smaller the longer you do so.,t3_ivrpis,1600547481.0
516,You can make songs get stuck in peoples head,t3_iv415b,1600455989.0
517,An very irish superpower,t3_ivz88i,1600572977.0
518,You can take a random person's on Earth shit for them,t3_ivuukg,1600558915.0
519,You can control the psi of your ejaculations,t3_ivoaf5,1600530527.0
520,Everyone can hear your thoughts,t3_ivtfgd,1600554223.0
521,"When you anything smaller than your hand, it will bounce like it is made of rubber.",t3_ivvmvg,1600561483.0
522,Any alcoholic beverage you come in contact with turns into water,t3_ivmqf6,1600522799.0
523,You cannot see people or moving objects in reflections.,t3_ivserm,1600550381.0
524,You can piss backwards,t3_ivng08,1600526226.0
525,You can give people second aid.,t3_ivfrpa,1600495799.0
526,You can change a redditors name to [deleted],t3_iv44g5,1600456458.0
527,"Every time you think something like “I wish this would happen”, reality splits into two timelines, one where it does happen, one where it doesn’t, and your conscience remains on the timeline where nothing happened",t3_iviuwu,1600506908.0
528,You can slow down time at the DMV,t3_ivky4o,1600515035.0
529,You can make other people's buttcracks horizontal instead of vertical,t3_ivjzjy,1600511149.0
530,When you brush/comb your hair it doesn't hurt,t3_ivx0xn,1600565915.0
531,Have a healing factor that heals any wound 0.15% faster,t3_ivek7h,1600491877.0
