,0,1,2
802,You can tell if someone is lying if they tell you so,t3_izp7qc,1601088006.0
803,In a similar fashion to Avatar The Last Airbender you too are now a bender... of pubes,t3_iz9lu1,1601023514.0
804,"People will never reply to your texts with a ""hmmm"".",t3_izezxi,1601046595.0
805,"As long as you're completely naked and not touching any part of yourself, you're invulnerable.",t3_izg8o4,1601053604.0
806,You can take your nose off to pick it.,t3_izfmkv,1601050035.0
807,You are just as invisible as you feel you are.,t3_izekzj,1601044391.0
808,"You have a paralyzing fear of water, and every time you think about swimming and feel that fear everyone within 5 miles screams and slaps themselves.",t3_izgmki,1601055875.0
809,You can explain to people why Epstein didn't kill himself.,t3_iz18ku,1600996080.0
810,"Every time you think in of a number, someone randomly around the world will have his finger grown that size",t3_izhfz5,1601060532.0
811,You can gain or lose weight by willing non-lethal constipation or diarrhea upon yourself for as long as necessary to get the job done.,t3_izcjd5,1601034993.0
812,Time only moves when looking at a clock.,t3_izbfzr,1601030521.0
813,"You can teleport, but only to the location of the nearest Juggalo",t3_izirxk,1601066746.0
814,You have x-ray vision,t3_izewjl,1601046081.0
815,"When you masturbate in a room with closed doors, anyone who wants to open any door must solve a reCAPTCHA. Effect voided when you orgasm.",t3_iyze68,1600990288.0
816,"Whenever you dab, a random person farts.",t3_izen3c,1601044687.0
817,"You can never lose your nerf darts, ever",t3_izcbu4,1601034103.0
818,You can teleport short distance only when people eyes are closed,t3_izg4pq,1601052946.0
819,You know what Time is it in random Country Just by taking a shit,t3_izen56,1601044693.0
820,Anything you touch becomes the last thing you touched.,t3_izbiov,1601030827.0
821,Your hair is spaghetti,t3_izargl,1601027924.0
822,You can summon crayons by pulling them out of other people's pockets,t3_iz2kh3,1601000163.0
823,"Every time your heart beats someone random in the world becomes 1% shorter, this can incude you.",t3_izbc0d,1601030097.0
824,All your limbs have foreskin,t3_izeuiu,1601045778.0
825,every time you fart on Tuesday at 4:30 pm someone you hate gets a bowl of cold pasta,t3_iz12tw,1600995556.0
826,You are granted the power of invisibility and you need to do a triple backflip to activate it,t3_iz189o,1600996051.0
827,You can give yourself temporarily deafening tinnitus to tune out other loud or annoying noises,t3_ize79z,1601042489.0
828,If a type of porn dose not exist you can make it exist by doing that type of new porn with a person.,t3_izbkrg,1601031056.0
829,"You can slow down time 90% for you at will, so you move and think ten times as fast",t3_iz9449,1601021672.0
830,You can desychronize all clocks in a 1 kilometer radius at will.,t3_izci53,1601034841.0
831,You can sprint full speed while carrying a hot drink and not spill a drop.,t3_iyw33f,1600978408.0
832,You can lick your elbow,t3_iz6f1u,1601012230.0
833,You can only eat what your reddit username is.,t3_izbt21,1601031974.0
834,Your mutant evolution has given you the proper anatomy to posses a functional cloaca.,t3_izen2c,1601044684.0
835,"You can freely move any object 2 solar masses or larger at speeds up to .99c, so long as you are within 10au of said object.",t3_izbfyz,1601030518.0
836,"Everytime you pee in bed, someone else's bed gets wet.",t3_iz15dp,1600995787.0
837,Magical van of stuff and things,t3_izbuya,1601032185.0
838,You can slow down any elevator that you are inside,t3_iy9m5e,1600894814.0
839,Everytime you come across a good and funny meme you are granted a dolar and you have to pay 50 cents for every meme you see,t3_iz19w2,1600996189.0
840,Your power is you're invisable only at the skin layer,t3_iz8cll,1601018900.0
841,You can eat plain nacho cheese Doritos vertically in one bite.,t3_iz1emi,1600996605.0
842,You can walk on water only when you are walking backwards,t3_iyypy7,1600988046.0
843,You can look at yourself in the mirror while wiping your butt without feeling ashamed about yourself.,t3_iyyg4z,1600987119.0
844,You can make disappear the last word of any,t3_iz3aow,1601002361.0
845,Every single ass hair you have can move and has its own will.,t3_iz7azi,1601015158.0
846,You have super-hightened sense of smell with a bad memory of what the smell is of,t3_iz0v17,1600994888.0
847,"You can only laugh at the worse possible times, and your laugh is a really bad cliche evil laugh.",t3_iyz88e,1600989745.0
848,Everytime you smell something familiar thr urge to take a shit increases by 20%,t3_iz12tr,1600995556.0
849,You have an amazing voice. Any person who hears your voice for the first time stops whatever he/she was doing and appreciates it for 10 whole minutes.,t3_iz2kbo,1601000149.0
850,"When you hug someone, they get a cool superpower.",t3_iyub9z,1600970114.0
851,"You are able to make 1 wish every time you kill someone. You cannot wish them back to life, and you cannot wish for more wishes.",t3_iyzh22,1600990535.0
852,"You Can Run At The Speed Of Light for 0.1 Seconds, And You Can Only Do It Once",t3_iz11me,1600995451.0
853,"Everytime you kiss a certain person, you swear you can fly",t3_izd6aj,1601037693.0
854,Your tears taste sweet instead of salty,t3_iyx7jg,1600982729.0
855,You can cure yourself from all diseases by eating a full bar of soap,t3_iyx6m1,1600982629.0
856,You can pay for microtransactions with Cash by inserting it some how into your gaming console or pc,t3_iyvqjt,1600977016.0
857,You can choose what colour your eyes are,t3_iyurp1,1600972431.0
858,"When you hold your breath, you become weightless.",t3_iyt4is,1600963637.0
859,When you have your pants on your dick is massive except when you take them off it instantly becomes tiny,t3_iyzv5a,1600991794.0
860,Everytime you sneeze your eyelashes change with the ones of a random person,t3_iyunlc,1600971858.0
861,"Whenever you touch someone, you will be able to decide whether or not the soap will be foamy when the next time they take a shower.",t3_iyvm5e,1600976467.0
862,"You can read the first chapter of a book by looking at its cover, online or otherwise.",t3_iyuupf,1600972848.0
863,You have the power to forget your cake day,t3_iyy1my,1600985723.0
864,You can squeeze out hairs like popping pimples,t3_iyx3kt,1600982302.0
865,You can shift the location of your wounds.,t3_iyt4k8,1600963642.0
866,Your eyes are made of bacon,t3_iys0kj,1600957831.0
867,You can teleport at will,t3_iysje1,1600960588.0
868,Red Bull with extra steps,t3_iyuq6h,1600972219.0
869,you can give people explosive diarrhea by winking at them witch both eyes at the same time,t3_iyt202,1600963279.0
870,"You have the ability to switch context immediately with the person you are conversing with, avoiding to reiterate the backstory.",t3_iyviwn,1600976078.0
871,You cannot be accidentally hurt.,t3_iyt4jg,1600963639.0
872,When you smile everyone smiles back at you.,t3_iyr39x,1600953486.0
873,You can get that one hair off your tongue on the first try,t3_iyq4zu,1600949463.0
874,Between 3-4 pm you can immediately summon any famous person literally by your side. They really like you for 10 minutes then after that they try and kill you. At 4 pm they get sent back.,t3_iyqa4b,1600950043.0
875,While both of your hands are touching your face you can see perfectly in the dark,t3_iyns8m,1600940767.0
876,"You have the ability to be invincible if your standing still, just have a really bad itch in a spot you can’t reach.",t3_iyoo5z,1600943930.0
877,Every time you strike a pose anyone who looks at you will hear Jojo music in their head,t3_iy9ug8,1600895622.0
878,It is impossible for everyone in your vicinity to filter out the rude words from their speech.,t3_iysl5d,1600960840.0
879,You can turn your fingers into fish fingers,t3_iyn9x6,1600939045.0
880,"When your bladder is full, it becomes a deity that must be worshiped in the eyes of others and a demon that must be killed when it’s empty.",t3_iyoope,1600943991.0
881,You can fasttalk people about why they should become a jehovah's witness until you are completely exausted,t3_iyrnhg,1600956021.0
882,You can read minds and you hear it in a long lost dialect,t3_iymi35,1600936570.0
883,"Every time you fart, a random person around the world gains the ability to burp 0.1 decibels louder.",t3_iyc58m,1600903261.0
884,Nickelback songs for receiving nickels,t3_iyrc21,1600954587.0
885,You are biologically immortal. You can’t die of of old age yet you will still be susceptible to diseases and physical trauma,t3_iyhw5h,1600920288.0
886,"You are Invisible, but only when nothing is looking at you.",t3_iybz0o,1600902712.0
887,You can make subways go out of service at will,t3_iym5v4,1600933626.0
888,promises made to someone on their deathbed will have the exact opposite effect,t3_iyp9br,1600946107.0
889,You can weaponize turtles by shoving them in people’s asses,t3_iyf6e7,1600912371.0
890,Turning a computer off and on again fixes every computer problem,t3_iyimv7,1600922471.0
891,You can turn plastic into paper,t3_iyksy4,1600929107.0
892,Your pinky toe has the ability to find the corner of anything while walking or running.,t3_iybc14,1600900656.0
893,Your dick appears 2 inches larger when women aren't looking at it,t3_iycaq8,1600903725.0
894,you can waterbend the toilet water that you shit in,t3_iyi76l,1600921172.0
895,"You can fly, just an inch off the ground",t3_iye4uh,1600909320.0
896,You can slow time by making people uncomfortable. The more awkward the slower time passes.,t3_iyh2um,1600917988.0
897,You can open a portal to any place in the universe except you cant control the size and it never closes.,t3_iyfm4j,1600913666.0
898,You can tickle anyone at a range of 10 meters,t3_iy7hnx,1600885199.0
899,You can make anybody's farts sould like a song of your choosing.,t3_iybsdo,1600902140.0
900,You will not experience the fear of falling off the chair everytime you lean back a little bit too much,t3_iyc4ll,1600903207.0
901,"Every time you break something, it immediately becomes clean",t3_iyibra,1600921547.0
902,Everything you say is a JoJo reference.,t3_iydzwm,1600908908.0
903,You can control the rate at which time flows for everyone and everything everywhere while maintaining precisely the relativity matrix within which the universe operates.,t3_iym16c,1600933206.0
904,You can control all of the world’s warm mashed potatoes at once,t3_iydapw,1600906837.0
905,whenever chewing gum your shoe gets gum on it the worst things that can get on it get on it.,t3_iykfsb,1600927980.0
906,Your penis can switch places with any hole in your body.,t3_iyhz3i,1600920510.0
907,Every chair you sit on has a 70/30 chance of falling apart,t3_iybfkh,1600900975.0
908,People can't talk shit behind your back,t3_iycc8m,1600903861.0
909,You can make your piss any color if you ate food with that color within 24 hours.,t3_iyhspx,1600920018.0
910,"Everytime you get punched/hurt, a ""harder, daddy"" sound effect plays",t3_iybbaw,1600900592.0
911,You can perfectly mimic the voice of Bill Cosby while on television.,t3_iyfn1a,1600913745.0
912,Designated driver hangovers,t3_iyr88t,1600954114.0
913,"You can see the future, only the cringy moments that will happen to you and nothing else.",t3_iyc8xh,1600903572.0
914,You can stop someone else from sneezing and it makes you sneeze instead.,t3_iyjjal,1600925139.0
915,People Cannot open the post and see the rest of the text in the discription,t3_iycd21,1600903936.0
916,You can grind salt and pepper by holding them in your palm and moving your hands as if you are using a salt grinder,t3_iyf5h2,1600912292.0
917,You can get that one hair off your younger on the first try,t3_iyq444,1600949364.0
918,You can always get the pre-order bonus for videogames,t3_iyapiv,1600898576.0
919,You can teleport 1-3.Ft in a random direction,t3_iybj7o,1600901319.0
920,"Whenever you want to rexperience nostalgia, you can time travel to that point of time.",t3_iybygp,1600902662.0
921,"Everything you see is a flaming homosexual, and people who are flaming homosexual, are straight lawyers",t3_iyel77,1600910636.0
922,Mosquitoes are happy to see you.,t3_iyalnn,1600898233.0
923,You can loose hair whenever you want and it falls all at once,t3_iyjz1d,1600926524.0
924,"You can see and talk to dead people. They don't say or do anything, themselves though, because they're dead.",t3_ixjfh2,1600791780.0
925,Everytime you touch a dog he will massively cum,t3_iy7gar,1600884987.0
926,You are deaf while sleeping.,t3_iy7qn4,1600886492.0
927,You can read people's minds. Everything is translated into a language you can't understand.,t3_iy5tgl,1600875955.0
928,"You can say the n word and black people will see you black everytime you say it, so you good",t3_iy7h9x,1600885141.0
929,The ability to predict the weather everytime you get a migraine.,t3_iy9w13,1600895784.0
930,What ever you do will always be reflected back on you except with a 100x multiplier such as hit a person softly your head will explode or you will get severe brain trauma.,t3_iyf1zd,1600912002.0
931,You can telepathically project the comebacks you make in the shower.,t3_iy3lpd,1600864562.0
932,"Every time you upvote anything on Reddit, the post gets a free silver award.",t3_ixyztp,1600846703.0
933,Every door you want to open unlocks immediately,t3_iy76v5,1600883601.0
934,You can now instantly tell if someone has lost a game of russian roulette.,t3_iy593v,1600872870.0
935,You can make random objects grow hair of any length.,t3_iy3pr3,1600865076.0
936,"Everytime you go take a dump, you become the best singer in the entire world",t3_iy7i0l,1600885251.0
937,Your crush and any girl on the world will consider you attractive,t3_iy7gze,1600885093.0
938,You can predict tomorrow’s fake news,t3_iy6kti,1600880175.0
939,You can change the curvature of beans,t3_iy0gfs,1600852058.0
940,You put a industrial smelter in Roblox Skyblock in another person's chest that is not yours,t3_iyag9f,1600897725.0
941,You have all the knowledge of how to play a violin when holding a guitar.,t3_ixweml,1600837866.0
942,"Anytime you’re around any kind of corn, it turns into popcorn",t3_iy2rjh,1600860983.0
943,Everytime you get hit by a car it changes color,t3_iy1qku,1600856920.0
944,"Whenever you're in a public bathroom, you have the ability to turn into an insect of your choise. You can only turn back into a human in a kitchen",t3_iy6j8w,1600879930.0
945,You aren’t able to... yeah that’s it you just aren’t able to,t3_iy232e,1600858257.0
946,You can guess the expiration date of food and drink just by looking at the tag.,t3_ixx81x,1600840476.0
947,You can grow your toes any length you want.,t3_ixz4hk,1600847161.0
948,"You can open up a character customization menu for real people by saying ""Tell me about yourself, are you a boy or a girl?"" to them. Only they get to choose what to change.",t3_iy0tl8,1600853411.0
949,"When you kiss someone, wherever you are, a pigeon will find you and shit on you.",t3_iy45kw,1600867187.0
950,Whenever someone says «I’m so hungry I could eat a whole (insert animal)» you can summon said animal and the person is forced to eat it.,t3_ixq629,1600818998.0
951,You do not have the ability to be able to,t3_ixwuat,1600839242.0
952,"You are the most Beautiful person alive, only when no one is looking",t3_iy3x99,1600866073.0
953,Every time you masturbate one of your friends will simultaneously cum with you,t3_iy29nu,1600858976.0
954,You change your gender after having sex.,t3_ixlkub,1600803063.0
955,"Whenever you say “Or is it?”, Vsauce music starts playing",t3_ixqyc6,1600821334.0
956,You get to choose your own power in the comments and I reply with side effects,t3_ixx5hq,1600840248.0
957,"You summon any object in front of you by scheming at the top of your lungs ""GIVE ME (insert object here)!""",t3_ixyibi,1600844945.0
958,"Everytime you sneeze, you teleport, you cant control your sneezes or where you teleport to.",t3_ixvm10,1600835384.0
